code;name;street_adress;number_adress;district_adress;cep_adress;phone;id_zone_adress
98105;CMEI 1º DE MAIO;RUA MOTORISTA GENESIO CARVALHO;613;AGUA MINERAL;64007650;8632257658;2
98201;CMEI CASSIA CRISTINA;RUA PROFESSOR PAULO FREIRE;758;SANTA CRUZ;64000180;8632276195;4
98202;CMEI VOVO LAIS;RUA HENRIQUETA TEIXEIRA;2091;SANTO ANTONIO;64028130;8632196759;4
98203;CMEI JESUS DIOCESANO;PARQUE ADRA PARQUE PIAUI - DE 6667 A 6768;1551;PARQUE PIAUI;64025050;8632276480;4
98204;EM ROSANGELA REIS;QUADRA ADRA 12 CJ STA FE;S/N;SANTA CRUZ;64028876;8632165068;4
98206;CMEI LUTERANO;AVENIDA PREFEITO WALL FERRAZ - LADO PAR;7200;PARQUE PIAUI;64025468;8632345007;4
99100;CMEI PADRE EDUARDO;CONJUNTO SAO JOAQUIM;4535;SAO JOAQUIM;64005450;8632174693;2
99102;CMEI APOLONIA CARVALHO;VILA APOLONIA;257;SAO JOAQUIM;64005410;8632179464;2
99103;CMEI NATUREZA;RUA DOM AVELAR;3170;BUENOS AIRES;64008290;8632257766;2
99104;CMEI PEIXE VIVO;ALAMEDA AMEDA DOMINGOS JORGE VELHO;6766;POTI VELHO;64004800;8632141133;2
99105;CMEI MONTE VERDE;RUA AMADEUS PAULO;4530;SANTA ROSA;64011030;8694629456;2
99106;CMEI TIA SABINA;RODOVIA DOVIA PI - 112 KM - 22;S/N;SANTA LUZ DE BAIXO;64067994;8632381603;1
99107;CMEI SANTA TERESINHA;RUA 02;S/N;CAMPESTRE;64041990;8632382015;1
99108;CMEI PARQUE FIRMINO FILHO;QUADRA ADRA S RES PAULO DE TARSO;2170;SANTA MARIA;64012840;8632259468;2
99109;CMEI VILA PANTANAL II;RUA GASTON DE GRESLAN;2000;PARQUE ALVORADA;64004450;8632139464;2
99110;CMEI TIA REGINA NAPOLEAO;RUA PADRE GERALDO;634;MAFRENSE;64005610;8632175832;2
99111;CMEI SANTA MARIA DAS VASSOURAS;RUA CHICO CONRADO;1160;SANTA MARIA;64012590;8632111330;2
99113;CMEI PARQUE WALL FERRAZ;RUA MARIA JOSE DE MELLO FREITAS;2330;SANTA MARIA;64013030;8632111379;2
99114;CMEI SANTA MARIA DA CODIPI;RUA FRANCISCO MAGNOLIA;2800;SANTA MARIA;64012470;8632111122;2
99115;CMEI FRANCISCO DE ASSIS;RUA MARIA LUZIA VILLA;5790;MOCAMBINHO II;64010372;8632166063;2
99200;CMEI TIA ANITA;RUA PEDRO PORTELA;1387;ANGELIM;64034360;8632117497;4
99202;CMEI ENILSON CARVALHO;RUA TENENTE TADEU;3421;SANTO ANTONIO;64028180;8632119382;4
99204;CMEI RESIDENCIAL ESPLANADA;RUA SAO VALENTINO LOT 7 ESTRELAS;7610;ANGELIM;64040060;8632191221;4
99205;CMEI ANGELIM IV;RUA CAPITAO GABRIEL LEITE;1434;ANGELIM IV;64034425;8632166213;4
99206;CMEI RESIDENCIAL BETINHO;AVENIDA MANOEL FERNANDES DE OLIVEIRA;1546;ANGELIM;64034440;8632209522;4
99207;CMEI VILA CLEMENTE FORTES;AVENIDA DEPUTADO ULISSES GUIMARAES - LADO IMPAR;1950;PROMORAR;64027330;8632166228;4
99209;CMEI VILA CAROLINA SILVA;RUA DONA FRANCISCA CLAUDINO VL CAROLINA;1035;DISTRITO INDUSTRIAL;64027455;8632113026;4
99210;CMEI BOM JESUS WALL FERRAZ;RUA PAPAGAIO;186;SANTA CRUZ;64028565;8632203999;4
99211;CMEI IRMA DULCE;RUA BAU VL IRMA DULCE;3256;ANGELIM;64040542;8632193859;4
99212;CMEI PROFESSOR WALL FERRAZ;POVOADO VOADO CERAMICA CIL;2330;CERAMICA CIL;64000180;8632195191;4
99214;CMEI VILA TIRADENTES;RUA CRUZEIRO DO SUL;378;SANTO ANTONIO;64033090;8632166212;4
99215;CMEI SANTA HELENA;RUA MANOEL VITOR CORDEIRO;5950;BRASILAR;64035410;8632192003;4
99216;CMEI VILA CONCORDIA E MORADA NOVA;RUA RADIALISTA BENEDITO DE ASSIS;3168;BELA VISTA;64031085;8632213171;4
99300;CMEI VILA BANDEIRANTES;RUA DOM BOSCO;4920;PORTO DO CENTRO;64060742;8632345879;1
99301;CMEI PARQUE ANITA FERRAZ;RUA TIMORANTE;S/N;TABAJARAS;64067160;8632345660;1
99303;CMEI PARQUE MAO SANTA;RUA DEZENOVE;6140;VALE QUEM TEM;64057610;8632306346;1
99304;CMEI BOM SAMARITANO;RUA SAO CAMILO;1269;CAMPESTRE;64053795;8632303758;1
99305;CMEI DONA MARIA DE JESUS ARAUJO SILVEIRA;RUA SALITRE;7800;PEDRA MOLE;64066080;8632303003;1
99306;CMEI VILA DO AVIAO;RUA NAMBU VL AVIAO;1021;PEDRA MOLE;64065130;8632318121;1
99307;CMEI CIDADE LESTE;RUA SATURNINO ROLINS MORAIS;5437;VERDE LAR;64071060;8632344231;1
99308;CMEI TAPUIA;ESTRADA DA CAJAIBA, POVOADO TAPUIA;S/N;POVOADO TAPUIA;64000180;8632317064;1
99309;CMEI LADEIRA DO URUGUAI;RUA PROFESSORA JULIETA NEIVA NUNES;6397;URUGUAI;64073500;8632343631;1
99310;CMEI DOM AVELAR;RESIDENCIAL DOM AVELAR;3150;VALE QUEM TEM;64057560;8632349919;1
99311;CMEI PLANALTO URUGUAI;RUA JUIZ SALMON LUSTOSA NOGUEIRA RESIDENCIAL;6541;VALE QUEM TEM;64057235;8632345052;1
99400;CMEI NOSSA SENHORA DA GUIA;RUA GABRIEL SOARES;46;BEIRA RIO;64075510;8632365845;3
99401;CMEI NOVO MILENIO;CAMPO DIEGO MADEIRA CAMPOS;585;SAO SEBASTIAO;64084070;8632312223;3
99402;CMEI GILCA VANESSA;RUA RONDONIA;4011;NOVO HORIZONTE;64080050;8632357758;3
99404;CMEI VILA POTY II;RUA DEPUTADO PINHEIRO MACHADO;4103;RENASCENCA;64082330;8632311889;3
99408;CMEI MENINO JESUS;RUA DESEMBARGADOR ODORICO ROSA;4806;EXTREMA;64076385;8632357488;3
99409;CMEI TIO FERNANDO SANTIAGO;RUA LUIZ ALVES LIMA;1176;SANTANA;64097024;8632359785;3
99410;CMEI PARQUE ESPERANCA;RUA PROFESSOR JOSE DE SENA;100;EXTREMA;64076430;8632365233;3
99411;CMEI FREI DAMIAO;RUA CARLOS FEITOSA;979;GURUPI;64090030;8632161976;3
99412;CMEI VILA MARIANA FORTES;RUA ANCHIETA;2112;ITARARE;64078255;8632317396;3
99413;CMEI RESIDENCIAL FIRMINO FILHO;FORTE ADVOGADO JOSE FORTES NAPOLEAO DO REGO;5740;PARQUE POTI;64081050;8632347338;3
